,姓名,上任日期,经理代号,简介,基金名称,基金代码,基金类型,起始时间,截止时间,任职天数,任职回报,同类平均,同类排名
0,邓默,2019-03-08,无,"邓默先生:中国籍,数学博士,具有基金从业资格。2011年6月加入华商基金管理有限公司,从事金融工程与产品设计工作;2015年1月6日至2015年6月30日担任公司量化投资部总经理助理;2015年7月1日至2017年3月10日担任产品创新部副总经理;2015年9月9日至2017年4月26日担任华商大盘量化精选灵活配置混合型证券投资基金基金经理;2015年9月9日起至今担任华商新量化灵活配置混合型证券投资基金基金经理;2015年9月9日起至今担任华商量化进取灵活配置混合型证券投资基金基金经理;2018年2月23日起至今担任华商动态阿尔法灵活配置混合型证券投资基金基金经理;2019年3月8日起至今担任华商红利优选灵活配置混合型证券投资基金基金经理;2019年9月17日起至今担任华商电子行业量化股票型发起式证券投资基金基金经理;现任量化投资部总经理、公司投资决策委员会委员、公司公募业务权益投资决策委员会委员。2019年10月30日担任华商计算机行业量化股票型发起式证券投资基金基金经理。",华商量化优质精选混合,010293,混合型,2020-09-24,至今,17天,,,-|-
1,,,,,华商计算机行业量化股票,007853,股票型,2019-10-30,至今,347天,30.62%,37.47%,772|1261
2,,,,,华商电子行业量化股票,007685,股票型,2019-09-17,至今,1年又25天,57.27%,37.48%,246|1232
3,,,,,华商红利优选混合,000279,混合型,2019-03-08,至今,1年又218天,59.96%,53.08%,1143|2893
4,,,,,华商动态阿尔法混合,630005,混合型,2018-02-23,至今,2年又231天,55.92%,47.76%,834|2512
5,,,,,华商新量化混合,000609,混合型,2015-09-09,至今,5年又34天,132.74%,83.75%,197|1081
6,,,,,华商量化进取混合,001143,混合型,2015-09-09,至今,5年又34天,100.15%,83.75%,363|1081
7,,,,,华商大盘量化精选混合,630015,混合型,2015-09-09,2017-04-26,1年又230天,11.64%,8.76%,380|1123
